{
  "id": 2,
  "type": "pages",
  "title": "Page With Content",
  "slug": "/page-with-content",
  "content": {
    "elements": [
      {
        "id": 10,
        "type": "text",
        "content": {
          "header": "Introduction",
          "bodytext": "Bienvenue sur notre page de test"
        }
      },
      {
        "id": 11,
        "type": "text",
        "content": {
          "header": "Notre Mission",
          "bodytext": "Former les musiciens de demain"
        }
      },
      {
        "id": 12,
        "type": "text",
        "content": {
          "header": "Témoignages",
          "bodytext": "Découvrez nos élèves"
        }
      }
    ]
  }
}